{
  "_description": "Rust project with cargo nextest, JUnit report via derive_from, and lcov coverage.",
  "$schema": ".codeflow/schemas/test-config.schema.json",
  "schema_version": "1.0",
  "execution": {
    "parallel": false,
    "fail_fast": false
  },
  "defaults": {
    "coverage": []
  },
  "targets": [
    {
      "name": "rust-core",
      "enabled": true,
      "cwd": "codeflow-cli",
      "runner": "cargo",
      "modes": {
        "essential": {
          "command": "cargo nextest run --profile essential"
        },
        "full": {
          "command": "cargo llvm-cov nextest --profile full --lcov --output-path lcov.info"
        }
      },
      "report": {
        "format": "junit",
        "path": "target/nextest/full/junit.xml",
        "derive_from": "junit"
      },
      "coverage": {
        "format": "lcov",
        "path": "lcov.info",
        "rules": [
          {
            "scope": "per_file",
            "minimum": 85
          }
        ],
        "exceptions": [
          {
            "file": "core/src/autorun/worker.rs",
            "threshold": 79,
            "reason": "Autorun worker contains process spawning (tmux sessions, Claude Code invocation), async timeout handling, and worktree lifecycle management that require real process infrastructure to exercise. 20 tests cover all testable paths via injectable trait mocks (TmuxProvider, ClaudeProvider, WorktreeProvider). The uncovered lines are in run_worker() async execution, process output parsing, cleanup-on-crash paths, and the timeout salvage push (branches 1152-1192 in run()) which requires a real git worktree with unpushed commits to exercise — the worktree path includes a dynamically-generated session ID making pre-test setup impossible without refactoring. These paths cannot be unit-tested without spawning real tmux+Claude processes or a real git infrastructure.",
            "remove_when": "Integration test harness with mock tmux/Claude processes is implemented, or salvage push path is extracted to a testable helper with injectable git command runner, or file is refactored to extract more testable pure functions"
          },
          {
            "file": "cli/src/cmd/interactive.rs",
            "threshold": 65,
            "reason": "68+ tests cover all extractable pure functions and inner implementations. Remaining uncovered lines are structurally untestable: run_launch() calls exec(2) which replaces the process (cannot return to test harness); run_status/run_list/run_cleanup call detect_project_root() which requires real CWD with .git directory. Outer wrapper functions (sweep_stale_session_dirs, clean_session_worktree_map, mark_stale_worktree_entries) delegate to tested inner functions but are themselves uncovered because they construct paths from project_dir. Additionally, the --watch TUI dashboard added in INF-TSK-044-005 (run_status_tui event loop, render_session_header, render_session_table, render_session_detail at lines 757-1250) requires raw terminal mode and cannot be unit-tested, further reducing line coverage.",
            "remove_when": "run_launch refactored to return a Command without calling .exec(), detect_project_root made injectable, or TUI event loop refactored to allow headless rendering tests"
          },
          {
            "file": "cli/src/cmd/init.rs",
            "threshold": 70,
            "reason": "init.rs TUI wizard contains ratatui event loop (run_tui_wizard_with_runner) and 8 step rendering functions (render_step_*) that require a live terminal in raw mode -- cannot be unit-tested without spawning a real terminal. Injectable CommandRunner trait ensures business logic (handle_*_input, check_prerequisites, run_setup, run_verification_checks, run_non_interactive) is fully tested. 54 unit tests cover all extractable pure functions.",
            "remove_when": "TUI event loop refactored to allow headless rendering tests, or integration test harness with mock terminal is implemented"
          },
          {
            "file": "cli/src/cmd/autorun.rs",
            "threshold": 67,
            "reason": "Large CLI command file (7500+ lines) with tmux process management, batch orchestration, and interactive terminal output. Three TUI event loops (run_status_watch, run_batches_tui, run_batch_list/detail navigation) are structurally untestable. All extractable pure functions covered by 23 unit tests.",
            "remove_when": "TUI event loops refactored to allow headless rendering tests, or integration test harness with mock terminal is implemented"
          },
          {
            "file": "core/src/tui/mod.rs",
            "threshold": 0,
            "reason": "Pure module declaration file (pub mod data/theme/widgets) with no executable code. llvm-cov reports 0% but there is nothing to test.",
            "remove_when": "File gains executable code"
          },
          {
            "file": "core/src/tui/widgets/mod.rs",
            "threshold": 0,
            "reason": "Pure module re-export file (pub mod + pub use) with no executable code. llvm-cov reports 0% but there is nothing to test.",
            "remove_when": "File gains executable code"
          },
          {
            "file": "core/src/pathflow/mod.rs",
            "threshold": 0,
            "reason": "Pure module declaration file (pub mod checkpoint/gates/sentinel/transitions and a file_lock re-export) with no executable code. llvm-cov reports N/A but there is nothing to test.",
            "remove_when": "File gains executable code"
          },
          {
            "file": "core/src/testing/mod.rs",
            "threshold": 0,
            "reason": "Pure module declaration file (pub mod config/coverage/doctor/error/pr_body/report/runner/setup/threshold) with no executable code. llvm-cov reports 0% but there is nothing to test.",
            "remove_when": "File gains executable code"
          },
          {
            "file": "core/tests/integration_testing_setup.rs",
            "threshold": 0,
            "reason": "Integration test file — compiled as a separate test binary, not instrumented by llvm-cov unit coverage. llvm-cov reports N/A because integration tests run in their own binary outside the library instrumentation scope.",
            "remove_when": "Coverage tooling supports cross-binary instrumentation"
          },
          {
            "file": "core/tests/integration_self_host_parity.rs",
            "threshold": 0,
            "reason": "Integration test file — compiled as a separate test binary, not instrumented by llvm-cov unit coverage. llvm-cov reports N/A because integration tests run in their own binary outside the library instrumentation scope.",
            "remove_when": "Coverage tooling supports cross-binary instrumentation"
          }
        ]
      }
    },
    {
      "name": "shell-scripts",
      "enabled": true,
      "runner": "custom",
      "modes": {
        "essential": {
          "command": "bash .codeflow/testing/run-all-tests.sh --mode=essential --skip-structural --format=ctrf --output=ctrf.json"
        },
        "full": {
          "command": "bash .codeflow/testing/run-all-tests.sh --mode=full --skip-structural --format=ctrf --output=ctrf.json"
        }
      },
      "report": {
        "format": "ctrf",
        "path": "ctrf.json"
      }
    }
  ]
}
