{
  "_description": "Monorepo with three targets (Go, Node, Python) running in parallel.",
  "$schema": ".codeflow/schemas/test-config.schema.json",
  "schema_version": "1.0",
  "execution": {
    "parallel": true,
    "fail_fast": false
  },
  "defaults": {
    "coverage": []
  },
  "targets": [
    {
      "name": "api-go",
      "enabled": true,
      "cwd": "services/api",
      "runner": "go",
      "modes": {
        "essential": {
          "command": "go test ./..."
        },
        "full": {
          "command": "go test ./... -coverprofile=coverage.out"
        }
      },
      "coverage": {
        "format": "go-cover",
        "path": "coverage.out",
        "rules": [
          {
            "scope": "per_file",
            "minimum": 85
          }
        ]
      }
    },
    {
      "name": "web-node",
      "enabled": true,
      "cwd": "apps/web",
      "runner": "vitest",
      "modes": {
        "essential": {
          "command": "pnpm test --run"
        },
        "full": {
          "command": "pnpm test --run --coverage"
        }
      },
      "coverage": {
        "format": "istanbul-summary",
        "path": "coverage/coverage-summary.json",
        "rules": [
          {
            "scope": "per_file",
            "minimum": 85
          }
        ]
      }
    },
    {
      "name": "tools-python",
      "enabled": true,
      "cwd": "tools",
      "runner": "pytest",
      "modes": {
        "essential": {
          "command": "pytest -q"
        },
        "full": {
          "command": "pytest --cov --cov-report=xml"
        }
      },
      "coverage": {
        "format": "cobertura",
        "path": "coverage.xml",
        "rules": [
          {
            "scope": "per_file",
            "minimum": 85
          }
        ]
      }
    }
  ]
}
